author,created_utc,id,num_comments,score,subreddit,title,total_awards_received,date,datetime
Interesting_Bug_7644,1638130010,r4d1wj,0.0,1,CanadianStocks,****My Micron play against Omicron!****,0,2021-11-28,2021-11-28 20:06:50
teenworf1984,1638130044,r4d2dk,1.0,1,pregnant,Am I crazy for booking a babymoon to Mexico?,0,2021-11-28,2021-11-28 20:07:24
-en-,1638130046,r4d2el,0.0,1,newsbotbot,@Reuters: WHO says it is not yet clear if Omicron causes more severe disease https://t.co/fVBO0iZhbj https://t.co/8zstHFkLcy,0,2021-11-28,2021-11-28 20:07:26
-en-,1638130062,r4d2mn,0.0,1,newsbotbot,"@Reuters: S.African doctor says patients with Omicron variant have ""very mild"" symptoms https://t.co/W5wz8gQvYo https://t.co/y9zn7qNqB9",0,2021-11-28,2021-11-28 20:07:42
-en-,1638130067,r4d2pa,0.0,1,newsbotbot,@Reuters: Britain records third case of Omicron coronavirus variant https://t.co/swesxoFDyK https://t.co/7yDD0VdSm0,0,2021-11-28,2021-11-28 20:07:47
-en-,1638130072,r4d2rx,0.0,1,newsbotbot,@Reuters: Britain to call G7 health ministers meeting over Omicron https://t.co/Eg37Moex0m https://t.co/tXR4JyfIqW,0,2021-11-28,2021-11-28 20:07:52
calmerpoleece,1638130089,r4d30a,0.0,1,AusNews,Doctor who discovered Omicron variant calls for end to 'hype',0,2021-11-28,2021-11-28 20:08:09
Interesting_Bug_7644,1638130111,r4d3bm,0.0,1,pennystocks,****My Micron play against Omicron!**** ($DOCT.CN),0,2021-11-28,2021-11-28 20:08:31
politicly1,1638130119,r4d3fg,0.0,1,politiclyopinion,"Oh my, omicron: New Kansas bill protects 'right to die.' Why is GQP on COVID's side",0,2021-11-28,2021-11-28 20:08:39
AutoNewspaperAdmin,1638130132,r4d3lb,0.0,1,AutoNewspaper,"[World] - Lambda, Mu ... Omicron? Why the WHO skipped ‘Nu’ and ‘Xi’ to name latest coronavirus variant | South China Morning Post",0,2021-11-28,2021-11-28 20:08:52
AutoNewsAdmin,1638130159,r4d3xg,0.0,1,CNNauto,"[Video] - So far, almost all Omicron news coverage is speculative",0,2021-11-28,2021-11-28 20:09:19
calmerpoleece,1638130161,r4d3y2,0.0,1,AusNews,The Omicron variant reveals the true global danger of ‘vaccine apartheid’,0,2021-11-28,2021-11-28 20:09:21
Naijawapz1,1638130167,r4d40z,1.0,1,viral,Israel bans all travel from foreigners as COVID-19 Omicron cases grow in world,0,2021-11-28,2021-11-28 20:09:27
AutoNewspaperAdmin,1638130191,r4d4c8,0.0,1,AutoNewspaper,[World] - More omicron cases pop up as world rushes to learn more | Washington Times,0,2021-11-28,2021-11-28 20:09:51
AutoNewspaperAdmin,1638130193,r4d4d6,0.0,1,AutoNewspaper,[World] - South Africa’s President calls for urgent reversal of travel bans over Omicron | Al Arabiya,0,2021-11-28,2021-11-28 20:09:53
AutoNewspaperAdmin,1638130194,r4d4dp,0.0,1,AutoNewspaper,[World] - First image of Omicron shows many more mutations than Delta variant | Al Arabiya,0,2021-11-28,2021-11-28 20:09:54
Dramatic_Waltz_3645,1638130201,r4d4h3,0.0,1,FauciForPrison,Big Pharma Announce Plans For ‘Omicron’ The New Highly Evolved Covid Variant,0,2021-11-28,2021-11-28 20:10:01
AutoNewspaperAdmin,1638130242,r4d50p,0.0,1,AutoNewspaper,"[Video] - So far, almost all Omicron news coverage is speculative | CNN",0,2021-11-28,2021-11-28 20:10:42
Putinlovedogs,1638130247,r4d52w,1.0,1,tucker_carlson,Big Pharma Announce Plans For ‘Omicron’ The New Highly Evolved Covid Variant,0,2021-11-28,2021-11-28 20:10:47
AutoNewspaperAdmin,1638130255,r4d56u,0.0,1,AutoNewspaper,"[AU] - Australia news LIVE: Two Omicron COVID-19 variant cases in Sydney; Victoria, NSW consider reintroducing mandatory quarantine | Sydney Morning Herald",0,2021-11-28,2021-11-28 20:10:55
Putinlovedogs,1638130268,r4d5c9,1.0,1,Republican,Big Pharma Announce Plans For ‘Omicron’ The New Highly Evolved Covid Variant,0,2021-11-28,2021-11-28 20:11:08
Putinlovedogs,1638130281,r4d5j6,0.0,1,conservatives,Big Pharma Announce Plans For ‘Omicron’ The New Highly Evolved Covid Variant,0,2021-11-28,2021-11-28 20:11:21
AutoNewsAdmin,1638130305,r4d5ua,0.0,1,NYPOSTauto,[National] - NIH chief: COVID vaccines will ‘most likely’ protect against Omicron mutations,0,2021-11-28,2021-11-28 20:11:45
Last_Canary_6622,1638130307,r4d5v9,0.0,1,Jokes,If You're Going to Name a Virus Variant Omicron,0,2021-11-28,2021-11-28 20:11:47
M416_Lover,1638130308,r4d5vy,1.0,1,conspiracy,Big Pharma Announce Plans For ‘Omicron’ The New Highly Evolved Covid Variant,0,2021-11-28,2021-11-28 20:11:48
niuz-bot,1638130326,r4d64a,0.0,1,niuz,"Testele PCR sunt în continuare eficiente în detectarea noii variante Omicron, anunță Organizația Mondială a Sănătății/ Celelalte teste sunt puse sunt încă sub semnul întrebării - [Analize]",0,2021-11-28,2021-11-28 20:12:06
AutoNewspaperAdmin,1638130342,r4d6ca,0.0,1,AutoNewspaper,[Op-Ed] - Scale up supplies: On Omicron variant | The Hindu,0,2021-11-28,2021-11-28 20:12:22
AutoNewspaperAdmin,1638130434,r4d7hq,0.0,1,AutoNewspaper,[National] - NIH chief: COVID vaccines will ‘most likely’ protect against Omicron mutations | NY Post,0,2021-11-28,2021-11-28 20:13:54
M416_Lover,1638130449,r4d7pb,0.0,1,BidenIsNotMyPresident,Big Pharma Announce Plans For ‘Omicron’ The New Highly Evolved Covid Variant,0,2021-11-28,2021-11-28 20:14:09
M416_Lover,1638130460,r4d7ux,1.0,1,tucker_carlson,Big Pharma Announce Plans For ‘Omicron’ The New Highly Evolved Covid Variant,0,2021-11-28,2021-11-28 20:14:20
M416_Lover,1638130470,r4d7zs,0.0,1,conspiracyundone,Big Pharma Announce Plans For ‘Omicron’ The New Highly Evolved Covid Variant,0,2021-11-28,2021-11-28 20:14:30
OrwellWasRight69,1638130474,r4d80v,0.0,1,styxhexenhammer666,Styxhexenhammer Show ep. 34: The Omicron Obsession and More,0,2021-11-28,2021-11-28 20:14:34
Bonus1Fact,1638130524,r4d8pq,0.0,1,SaltyArmy,Is The Omicron Variant The 'Midterm Election Variant'?,0,2021-11-28,2021-11-28 20:15:24
Rouger7,1638130541,r4d8x9,0.0,1,memes,Omicron has joined the pandemic,0,2021-11-28,2021-11-28 20:15:41
NewsElfForEnterprise,1638130574,r4d9df,0.0,1,News_HealthBiotech,"PCRs detect Omicron, studies under way for other tests: WHO",0,2021-11-28,2021-11-28 20:16:14
lha1107,1638130574,r4d9di,0.0,1,TheOnionNews,"Prepare For The Worst’: Fauci Says Travel Bans Won’t Stop Omicron, Too Early To Say If More Lockdowns Are Coming",0,2021-11-28,2021-11-28 20:16:14
darshKing92,1638130579,r4d9g4,0.0,1,benshapiro,Big Pharma Announce Plans For ‘Omicron’ The New Highly Evolved Covid Variant,0,2021-11-28,2021-11-28 20:16:19
darshKing92,1638130590,r4d9lh,1.0,1,BidenBuzz,Big Pharma Announce Plans For ‘Omicron’ The New Highly Evolved Covid Variant,0,2021-11-28,2021-11-28 20:16:30
darshKing92,1638130602,r4d9rf,0.0,1,DebateVaccines,Big Pharma Announce Plans For ‘Omicron’ The New Highly Evolved Covid Variant,0,2021-11-28,2021-11-28 20:16:42
darshKing92,1638130616,r4d9xk,1.0,1,FauciForPrison,Big Pharma Announce Plans For ‘Omicron’ The New Highly Evolved Covid Variant,0,2021-11-28,2021-11-28 20:16:56
AusCOVID19,1638130633,r4da5d,0.0,1,AusCOVID19,Australia border rules change as concerns over Omicron variant swell around the world,0,2021-11-28,2021-11-28 20:17:13
TokenWhiteMage,1638130656,r4dagh,0.0,1,nursing,me about to start my new ICU job tomorrow while being bombarded by news of the Omicron variant,0,2021-11-28,2021-11-28 20:17:36
AutoNewsAdmin,1638130672,r4dao5,0.0,1,NYTauto,"[World] - Responding to the Omicron Variant, Israel and Morocco Impose Bans on All Foreign Travelers",0,2021-11-28,2021-11-28 20:17:52
glittall,1638130689,r4davw,0.0,1,u_glittall,A senior Amazon.com Inc executive said it remains too early to predict how the Omicron coronavirus variant will impact consumer spending during the holiday season but suggested that shoppers will press ahead for now.,0,2021-11-28,2021-11-28 20:18:09
Azh1aziam,1638130702,r4db23,0.0,1,ChurchOfCOVID,Moderna says an omicron variant vaccine could be ready in early 2022! Gods be praised!,0,2021-11-28,2021-11-28 20:18:22
NewsElfForEnterprise,1638130710,r4db63,0.0,1,NewsfeedForWork,"The Omicron variant has a 'record' number of mutations that may hinder vaccine effectiveness, NIH director says",0,2021-11-28,2021-11-28 20:18:30
anforob,1638130753,r4dbr2,0.0,1,Wallstreetsilver,The Greek Alphabet,0,2021-11-28,2021-11-28 20:19:13
OrwellWasRight69,1638130792,r4dc8e,0.0,1,JoeBidenIsADisaster,Biden Attacked By Far Left For Afro-Phobic Hypocrisy Over Omicron Travel Bans,0,2021-11-28,2021-11-28 20:19:52
PizzaSliceWithRanch,1638130796,r4dcah,0.0,1,conspiracy,The Lame Stream Media Made Up The Omicron Variant To Distract Us From TheJussie Smollett Trial Which Begins After Years of Delay,0,2021-11-28,2021-11-28 20:19:56
Kevin1141,1638130842,r4dcvk,0.0,1,Conservative,Big Pharma Announce Plans For ‘Omicron’ The New Highly Evolved Covid Variant,0,2021-11-28,2021-11-28 20:20:42
EvenExchange2347,1638130849,r4dcz4,0.0,1,Divisive_Babble,"Will there be a Christmas lockdown - Déjà vu? Can you think of any ""Faux pas"" to add to their to do must WRECK list?",0,2021-11-28,2021-11-28 20:20:49
DarthSkurj,1638130864,r4dd6d,0.0,1,wallstreetbets,Don’t let Omicron spoil Christmas…,0,2021-11-28,2021-11-28 20:21:04
mackey88,1638130885,r4ddgy,0.0,1,CLOV,Omicron could be a nothingburger,0,2021-11-28,2021-11-28 20:21:25
Kevin1141,1638130888,r4ddig,0.0,1,TrueAnon,Big Pharma Announce Plans For ‘Omicron’ The New Highly Evolved Covid Variant,0,2021-11-28,2021-11-28 20:21:28
MeetMattStryker,1638130891,r4ddju,0.0,1,brasilivre,Primeiros casos da Omicron foram pacientes totalmente vacinados,0,2021-11-28,2021-11-28 20:21:31
Mynewsify-Website,1638130897,r4ddmk,0.0,1,MynewsifyNews,"OPEC postpones technical meetings to evaluate Omicron impact: Report, Latest News",0,2021-11-28,2021-11-28 20:21:37
jthizz77,1638130897,r4ddmx,1.0,1,politics,"Germany, Italy, U.K. confirm cases of Covid omicron variant",0,2021-11-28,2021-11-28 20:21:37
OrwellWasRight69,1638130930,r4de2j,0.0,1,GoldandBlack,Emergency Broadcast: Omicron Variant Signals Next Phase In Globalist Bio-Attack,0,2021-11-28,2021-11-28 20:22:10
blazeitbets,1638130975,r4dena,0.0,1,CanadianStockExchange,Omicron variant play,0,2021-11-28,2021-11-28 20:22:55
Bonus1Fact,1638131027,r4dfc5,0.0,1,SaltyArmy,"NIH Director Francis Collins: Vaccines 'Most Likely' Protect Against Omicron Variant, 'No Reason to Panic'",0,2021-11-28,2021-11-28 20:23:47
Careful_Philosophy38,1638131033,r4dfew,0.0,1,u_Careful_Philosophy38,Omicron - Different Symptoms,0,2021-11-28,2021-11-28 20:23:53
Cantos,1638131091,r4dg4k,0.0,1,wallstreetbets,A look at the week ahead using options flow data: Covid Stocks edition $PFE $MRK $PTON $ZM $WMT etc,0,2021-11-28,2021-11-28 20:24:51
post-news,1638131122,r4dgj5,1.0,1,ExDemFoyer,"NIH Director Francis Collins: Vaccines 'Most Likely' Protect Against Omicron Variant, 'No Reason to Panic'",0,2021-11-28,2021-11-28 20:25:22
john_aliya,1638131136,r4dgpa,0.0,1,todaytrending,Omicron More Dangerous Than Delta? WHO’s Take In 5 Points,0,2021-11-28,2021-11-28 20:25:36
april9th,1638131168,r4dh49,0.0,1,redscarepod,Omicron Winter insp,0,2021-11-28,2021-11-28 20:26:08
p3b234cw4z2,1638131182,r4dhb3,1.0,1,conspiracy,Omicron bullshit...,0,2021-11-28,2021-11-28 20:26:22
AutoNewsAdmin,1638131198,r4dhio,0.0,1,GUARDIANauto,[UK] - What does appearance of Omicron mean for the double-jabbed?,0,2021-11-28,2021-11-28 20:26:38
niuz-bot,1638131227,r4dhx5,0.0,1,niuz,G7 convoacă de urgență miniștrii Sănătății pentru a discuta despre noua variantă de coronavirus Omicron - [Analize],0,2021-11-28,2021-11-28 20:27:07
Pennystonksnipa,1638131300,r4divy,0.0,1,CanadianStockExchange,Omicron variant play,0,2021-11-28,2021-11-28 20:28:20
Tylanmon,1638131362,r4djqh,0.0,1,CryptoCurrency,"A coin named ""Omicron"" rised in value after the new Corona variant discovered at the same name--That's it from me boys...",0,2021-11-28,2021-11-28 20:29:22
saurin212,1638131377,r4djxq,1.0,1,Republican,"Markets worried COVID omicron variant will lead to new restrictions, boost inflation: El-Erian",0,2021-11-28,2021-11-28 20:29:37
saurin212,1638131398,r4dk7d,0.0,1,Conservative,"Markets worried COVID omicron variant will lead to new restrictions, boost inflation: El-Erian",0,2021-11-28,2021-11-28 20:29:58
Bonus1Fact,1638131436,r4dkrw,0.0,1,SaltyArmy,"Britain, currently chair of G7 group of nations, calls for emergency meeting to discuss Covid crisis, after several European countries report cases of new Omicron variant",0,2021-11-28,2021-11-28 20:30:36
Tylanmon,1638131484,r4dlgf,0.0,1,CryptoCurrency,"A new coin name ""Omicron"" rocketed in value after scientists named the new Covid variant with the same name",0,2021-11-28,2021-11-28 20:31:24
individual93,1638131506,r4dlqo,1.0,1,conspiracy,"""Omicron"" South Africa timeline ...what is going on?!",0,2021-11-28,2021-11-28 20:31:46
AutoNewsAdmin,1638131513,r4dlty,0.0,1,GUARDIANauto,"[World] - Australia Covid live update: Omicron detected in NSW, states tighten border restrictions",0,2021-11-28,2021-11-28 20:31:53
elastiks,1638131614,r4dn5e,0.0,1,medical_trend,Nature Hot Discussion: Omicron variants will greatly reduce the effectiveness of COVID-19 vaccines?,0,2021-11-28,2021-11-28 20:33:34
infoday_us,1638131620,r4dn86,0.0,1,infoday,OPEC postpones technical meetings to evaluate Omicron impact -Bloomberg News,0,2021-11-28,2021-11-28 20:33:40
infoday_us,1638131622,r4dn95,0.0,1,infoday,OPEC postpones technical meetings to evaluate Omicron impact -Bloomberg News,0,2021-11-28,2021-11-28 20:33:42
DesignerFreedom,1638131625,r4dnai,0.0,1,unpopularopinion,"Omicron is hyped up BS, just like Covid.",0,2021-11-28,2021-11-28 20:33:45
DarthSkurj,1638131640,r4dnjc,0.0,1,wallstreetbets,"Don’t let Omicron spoil Christmas…Want something to community $pread vice COVID…perhaps Everlasting Ownership? Consider recommendations from an incongruously varied in appearance person who is unwise. If nothing else, it is something to look at other than porn!",0,2021-11-28,2021-11-28 20:34:00
PCisLame,1638131655,r4dnql,0.0,1,worldpolitics,"""If Omicron does render our VACCINES USELESS, that would basically mean we would be experiencing a WHOLE NEW PANDEMIC again, a WHOLE OTHER 2020, unless these vaccines are quickly tweaked for the new variant"" (and EVERYONE, ESPECIALLY the Dingbat Mind Slave Guinea Pigs, SUBMIT to FORCED INJECTIONS)",0,2021-11-28,2021-11-28 20:34:15
DemUnderground,1638131665,r4dnwf,0.0,1,DemocraticUnderground,"Oh my, omicron: New Kansas bill protects 'right to die.' Why is GOP on COVID's side?",0,2021-11-28,2021-11-28 20:34:25
maximkas,1638131672,r4dnzx,1.0,1,conspiracy,What if preventing omicron variant from spreading is a huge mistake? And what is a submission statement? Why should I write one for posting a screenshot of my own writing? Who is the $#$%$ moderating this subreddit? Thanks for your replies.,0,2021-11-28,2021-11-28 20:34:32
PCisLame,1638131687,r4do7t,0.0,1,TopConspiracy,"""If Omicron does render our VACCINES USELESS, that would basically mean we would be experiencing a WHOLE NEW PANDEMIC again, a WHOLE OTHER 2020, unless these vaccines are quickly tweaked for the new variant"" (and EVERYONE, ESPECIALLY the Dingbat Mind Slave Guinea Pigs, SUBMIT to FORCED INJECTIONS)",0,2021-11-28,2021-11-28 20:34:47
FlattenFearmongers,1638131704,r4dofx,0.0,1,ProVaxAntilockdown,Omicron: the Variant that Failed.,0,2021-11-28,2021-11-28 20:35:04
PCisLame,1638131715,r4dolm,0.0,1,DescentIntoTyranny,"""If Omicron does render our VACCINES USELESS, that would basically mean we would be experiencing a WHOLE NEW PANDEMIC again, a WHOLE OTHER 2020, unless these vaccines are quickly tweaked for the new variant"" (and EVERYONE, ESPECIALLY the Dingbat Mind Slave Guinea Pigs, SUBMIT to FORCED INJECTIONS)",0,2021-11-28,2021-11-28 20:35:15
PCisLame,1638131739,r4dowx,1.0,1,LockdownSkepticism,A Lung Doctor Broke Down the Omicron Variant in 5 Minutes,0,2021-11-28,2021-11-28 20:35:39
AutoNewsAdmin,1638131741,r4doxe,0.0,1,TIMESINDIAauto,"[IN] - ‘Omicron 6 times more transmissible than Delta, could infect even vaccinated’",0,2021-11-28,2021-11-28 20:35:41
GeorgeYDesign,1638131741,r4doxr,0.0,1,ABCaus,Omicron is now in Australia. What does that mean for Queensland?,0,2021-11-28,2021-11-28 20:35:41
AutoNewsAdmin,1638131742,r4doy6,0.0,1,WSJauto,[World] - Omicron Variant Found on Flights Reveals Gaps in Covid-19 Travel Rules,0,2021-11-28,2021-11-28 20:35:42
GeorgeYDesign,1638131744,r4doyt,0.0,1,ABCaus,"New COVID-19 variant, Omicron, set alarm bells ringing over the weekend. Here's what you need to know",0,2021-11-28,2021-11-28 20:35:44
Maleficent_Shake_428,1638131768,r4dpb1,0.0,1,BoneAppleTea,The Omicron variant is blessing in the sky,0,2021-11-28,2021-11-28 20:36:08
Bot-alex,1638131774,r4dpe2,0.0,1,NewsOfTheUK,What does appearance of Omicron mean for the double-jabbed?,0,2021-11-28,2021-11-28 20:36:14
zsreport,1638131776,r4dpf1,1.0,1,Coronavirus,How vaccine makers plan to address the new COVID-19 omicron variant,0,2021-11-28,2021-11-28 20:36:16
littlekind,1638131857,r4dqhi,0.0,1,FreeKarma4You,"Omicron COVID-19 variant: Pfizer, BioNTech say vaccine could be reworked in 100 days to counter strain",0,2021-11-28,2021-11-28 20:37:37
littlekind,1638131859,r4dqi4,0.0,1,FreeKarma4You,Boris Johnson orders return to face masks and isolation to slow omicron variant,0,2021-11-28,2021-11-28 20:37:39
Bonus1Fact,1638131876,r4dqq3,0.0,1,NewsShorts,United Kingdom records third case of new Omicron variant ¦ Sky News Australia,0,2021-11-28,2021-11-28 20:37:56
andysay,1638131904,r4dr32,0.0,1,centrist,More omicron cases pop up as world rushes to learn more,0,2021-11-28,2021-11-28 20:38:24
DesignerFreedom,1638131942,r4drm2,0.0,1,Jokes,Omicron Varient,0,2021-11-28,2021-11-28 20:39:02
sebal_fathey,1638093980,r41382,0.0,1,globalhealth,“Rapidly spreading” .. WHO reveals the reasons for the danger of the “Omicron” mutant,0,2021-11-28,2021-11-28 10:06:20
Mang32,1638094023,r413lg,0.0,1,funny,Omicron Covid-19,0,2021-11-28,2021-11-28 10:07:03
BananaHamara,1638094054,r413un,0.0,1,futurama,They say the Omicron variant is from South Africa…WAKE UP PEOPLE. We know where AND who it really came from………..,0,2021-11-28,2021-11-28 10:07:34
worldnewsbot,1638094066,r413yh,0.0,1,theworldnews,South African doctor who first alerted authorities says the symptoms of COVID-19's new Omicron variant are ‘unusual but mild’,0,2021-11-28,2021-11-28 10:07:46
-en-,1638094074,r4141i,0.0,1,newsbotbot,@Reuters: Austria reports first suspected case of Omicron COVID-19 variant https://t.co/B6SHSOy3n4 https://t.co/ALoK0DWOf4,0,2021-11-28,2021-11-28 10:07:54
Asset_value_cash,1638094130,r414k2,0.0,1,wallstreetbets,Please post and discuss here about the Classification of Omicron (B.1.1.529): SARS-CoV-2 Variant .,0,2021-11-28,2021-11-28 10:08:50
gnilognirg,1638094378,r416qn,1.0,1,conspiracy,They say omicron is a new variant thats highly contagious but then how do they know that with only a couple people being sick?,0,2021-11-28,2021-11-28 10:12:58
purplepagesorg,1638094424,r4174z,0.0,1,u_purplepagesorg,Corona’s Omicron Variant Can Be Cause Of 3rd Wave,0,2021-11-28,2021-11-28 10:13:44
bluehormones,1638094620,r418z8,1.0,1,AskReddit,"How's life going? This is the end of November 2021 and omicron is continuing the virus' legacy. I pray everyone stays hopeful, just a little more things will be better. I am hoping too.",0,2021-11-28,2021-11-28 10:17:00
Govindan_1978,1638094620,r418z9,0.0,1,u_Govindan_1978,"Cases of the Omicron Variant are detected in the UK, Germany and Italy; Israel closes its borders",0,2021-11-28,2021-11-28 10:17:00
AutoNewspaperAdmin,1638094737,r41a2l,0.0,1,AutoNewspaper,[World] - Travel curbs aimed at Omicron tighten across the world | Times of India,0,2021-11-28,2021-11-28 10:18:57
bluehormones,1638094756,r41a9f,0.0,1,AskReddit,"How's life going? It's Nov 2021 and Omicron continues the virus' legacy, is everyone doing okay?",0,2021-11-28,2021-11-28 10:19:16
AutoNewspaperAdmin,1638094774,r41aek,0.0,1,AutoNewspaper,[PH] - 14 countries now in PH's red list until Dec. 15 due to COVID-19 Omicron variant | Manila Bulletin,0,2021-11-28,2021-11-28 10:19:34
mooingmango,1638094796,r41ama,0.0,1,Coronavirus_NZ,"""New Zealand well-placed to detect and contain new Omicron Covid variant"" - Oh really?",0,2021-11-28,2021-11-28 10:19:56
optionhome,1638094819,r41avz,0.0,1,ConservativesOnly,"biden and Fauci’s Omicron travel ban ‘worse than useless,’ critics say. “No worries, travel ban begins next week because you know, variants don’t spread on holiday weekends” “Why do people still take this man seriously?”",0,2021-11-28,2021-11-28 10:20:19
AutoNewspaperAdmin,1638094867,r41bcl,0.0,1,AutoNewspaper,"[World] - Israel bars all foreigners, reinstates phone surveillance in effort to contain omicron variant | Washington Post",0,2021-11-28,2021-11-28 10:21:07
Personal_coach,1638094911,r41brk,0.0,1,wallstreetbets,Omicron is here boys…,0,2021-11-28,2021-11-28 10:21:51
niuz-bot,1638094925,r41bw9,0.0,1,niuz,Medic: Persoanele din Africa de Sud infectate cu tulpina Omicron nu au dezvoltat forme grave ale bolii / Cei mai mulţi pacienţi se plâng de dureri în corp şi oboseală extremă - [Articole],0,2021-11-28,2021-11-28 10:22:05
redit202,1638094938,r41c0u,0.0,1,reditsubs,Updated AM Forecast for 11/27/2021 5:35:05 AM,0,2021-11-28,2021-11-28 10:22:18
UTFO,1638094943,r41c25,0.0,1,RedditSample,Covid variant Omicron keeps spreading with cases found in Australia,0,2021-11-28,2021-11-28 10:22:23
AutoNewsAdmin,1638095118,r41dlx,0.0,1,IOLauto,[World] - Borders slam shut as world rushes to contain Omicron,0,2021-11-28,2021-11-28 10:25:18
Bozzaholic,1638095171,r41e31,0.0,1,colchestergazette,Omicron variant symptoms: What are the symptoms of the new Covid variant,0,2021-11-28,2021-11-28 10:26:11
rundown9,1638095340,r41fjw,0.0,1,WayOfTheBern,Novavax working on vaccine to combat omicron variant,0,2021-11-28,2021-11-28 10:29:00
WeWoweewoo,1638095357,r41fps,0.0,1,news,Australia confirms 2 omicron cases as travel curbs tighten,0,2021-11-28,2021-11-28 10:29:17
Masculine444,1638095575,r41hqd,0.0,1,CBSE,"CBSE Term -I POSTPONED or atleast Turned ONLINE. Board yet to decide . (Don’t have time to read full , just read capital letters.)",0,2021-11-28,2021-11-28 10:32:55
AusCOVID19,1638095611,r41i34,0.0,1,AusCOVID19,COVID Victoria: Anxiety tipped to surge as Omicron arrives in Australia,0,2021-11-28,2021-11-28 10:33:31
infoday_us,1638095617,r41i5h,0.0,1,infoday,"Israel will host Miss Universe contest next month despite Omicron, minister says",0,2021-11-28,2021-11-28 10:33:37
giotto64,1638095641,r41icx,0.0,1,u_giotto64,"opocaj: Variante Omicron, un caso in Campania. Era vaccinato con 2 dosi",0,2021-11-28,2021-11-28 10:34:01
WeWoweewoo,1638095656,r41iib,0.0,1,Coronavirus,Australia confirms two cases of Omicron COVID-19 variant,0,2021-11-28,2021-11-28 10:34:16
RedditAzania,1638095664,r41ikz,0.0,1,CoronavirusDownunder,'Patience is crucial': Why we won't know for weeks how dangerous Omicron is,0,2021-11-28,2021-11-28 10:34:24
Apxm,1638095734,r41j8i,0.0,1,worldnews,Australia confirms 2 omicron cases as travel curbs tighten,0,2021-11-28,2021-11-28 10:35:34
AutoNewsAdmin,1638095735,r41j8w,0.0,1,TIMESINDIAauto,"[IN] - Omicron variant has over 30 mutations, may evade vaccine immunity: AIIMS chief",0,2021-11-28,2021-11-28 10:35:35
littlekind,1638095832,r41k3s,0.0,1,FreeKarma4You,Australia confirms 2 omicron cases as travel curbs tighten,0,2021-11-28,2021-11-28 10:37:12
littlekind,1638095835,r41k4y,0.0,1,FreeKarma4You,Covid update: Australia confirms first Omicron cases |,0,2021-11-28,2021-11-28 10:37:15
Faction_Chief,1638095890,r41km1,0.0,1,NoFilterNews,/r/news - https://abcnews.go.com/Health/wireStory/australia-confirms-omicron-cases-travel-curbs-tighten-81429601,0,2021-11-28,2021-11-28 10:38:10
AutoNewsAdmin,1638095985,r41le5,0.0,1,THEHINDUauto,[Tech] - Omicron COVID-19 variant | Health Ministry directs States to enhance testing,0,2021-11-28,2021-11-28 10:39:45
123whatrwe,1638096007,r41lla,0.0,1,Seanergy,Covid vaccine effective against new Omicron variant: South Africa's health minister,0,2021-11-28,2021-11-28 10:40:07
AutoNewsAdmin,1638096019,r41lpe,0.0,1,TORONTOSTARauto,[World] - Australia confirms 2 omicron cases as travel curbs tighten,0,2021-11-28,2021-11-28 10:40:19
AutoNewsAdmin,1638096022,r41lqo,0.0,1,TORONTOSTARauto,[World] - Australia confirms 2 omicron cases as travel curbs tighten,0,2021-11-28,2021-11-28 10:40:22
123whatrwe,1638096050,r41lzb,0.0,1,IPIX_castaways,Covid vaccine effective against new Omicron variant: South Africa's health minister,0,2021-11-28,2021-11-28 10:40:50
Faction_Chief,1638096118,r41mlt,0.0,1,NoFilterNews,/r/worldnews - https://abcnews.go.com/Health/wireStory/australia-confirms-omicron-cases-travel-curbs-tighten-81429601,0,2021-11-28,2021-11-28 10:41:58
Faction_Chief,1638096122,r41mnc,0.0,1,NoFilterNews,/r/worldnews - https://www.theguardian.com/australia-news/2021/nov/28/covid-update-nsw-chief-health-officer-says-omicron-may-already-be-here,0,2021-11-28,2021-11-28 10:42:02
AutoNewspaperAdmin,1638096125,r41moe,0.0,1,AutoNewspaper,[World] - Australia confirms 2 omicron cases as travel curbs tighten | Toronto Star,0,2021-11-28,2021-11-28 10:42:05
AutoNewspaperAdmin,1638096127,r41mpl,0.0,1,AutoNewspaper,[World] - Australia confirms 2 omicron cases as travel curbs tighten | Toronto Star,0,2021-11-28,2021-11-28 10:42:07
AutoNewspaperAdmin,1638096172,r41n51,0.0,1,AutoNewspaper,[Tech] - Omicron COVID-19 variant | Health Ministry directs States to enhance testing | The Hindu,0,2021-11-28,2021-11-28 10:42:52
cavelin02,1638096179,r41n74,0.0,1,worldnews,"Covid-19: 'No need to panic' about Omicron variant, 'symptoms are mild' so far - SAMA board chair",0,2021-11-28,2021-11-28 10:42:59
dukof,1638096186,r41n9k,1.0,1,conspiracy,"""There is still no severity information for Omicron"" [ECDC 26/11-21]",0,2021-11-28,2021-11-28 10:43:06
Masculine444,1638096188,r41nag,0.0,1,CBSE,"CBSE TERM - I , CANCELLED DUE TO NEW COVID VARIANT “OMICRON”",0,2021-11-28,2021-11-28 10:43:08
